{
 "schema_version": 1,
 "instance_id": "sample_5stores",
 "second_stage_penalty_factor": 1.5,
 "depots": [
  {
   "depot_id": -1,
   "x": 35.0,
   "y": 35.0,
   "fixed_cost": 5600.0,
   "marginal_cost": 35.0,
   "max_size": 30.0
  },
  {
   "depot_id": -2,
   "x": 45.0,
   "y": 15.0,
   "fixed_cost": 5600.0,
   "marginal_cost": 35.0,
   "max_size": 30.0
  },
  {
   "depot_id": -3,
   "x": 2.0,
   "y": 23.0,
   "fixed_cost": 5600.0,
   "marginal_cost": 35.0,
   "max_size": 30.0
  }
 ],
 "stores": [
  {
   "store_id": 12,
   "x": 50.0,
   "y": 35.0
  },
  {
   "store_id": 77,
   "x": 53.0,
   "y": 43.0
  },
  {
   "store_id": 49,
   "x": 6.0,
   "y": 68.0
  },
  {
   "store_id": 9,
   "x": 55.0,
   "y": 60.0
  },
  {
   "store_id": 1,
   "x": 41.0,
   "y": 49.0
  }
 ],
 "scenarios": [
  {
   "scenario_id": 1,
   "name": "scenario 1"
  },
  {
   "scenario_id": 2,
   "name": "scenario 2"
  },
  {
   "scenario_id": 3,
   "name": "scenario 3"
  }
 ],
 "demand": [
  {
   "scenario_id": 1,
   "store_id": 1,
   "segment": "dry",
   "weekday": 0,
   "demand_t": 0.5674
  },
  {
   "scenario_id": 1,
   "store_id": 1,
   "segment": "dry",
   "weekday": 1,
   "demand_t": 0.5359
  },
  {
   "scenario_id": 1,
   "store_id": 1,
   "segment": "dry",
   "weekday": 2,
   "demand_t": 0.5674
  },
  {
   "scenario_id": 1,
   "store_id": 1,
   "segment": "dry",
   "weekday": 3,
   "demand_t": 0.6304
  },
  {
   "scenario_id": 1,
   "store_id": 1,
   "segment": "dry",
   "weekday": 4,
   "demand_t": 0.7565
  },
  {
   "scenario_id": 1,
   "store_id": 1,
   "segment": "dry",
   "weekday": 5,
   "demand_t": 0.725
  },
  {
   "scenario_id": 1,
   "store_id": 1,
   "segment": "fresh",
   "weekday": 0,
   "demand_t": 0.8337
  },
  {
   "scenario_id": 1,
   "store_id": 1,
   "segment": "fresh",
   "weekday": 1,
   "demand_t": 0.7874
  },
  {
   "scenario_id": 1,
   "store_id": 1,
   "segment": "fresh",
   "weekday": 2,
   "demand_t": 0.8337
  },
  {
   "scenario_id": 1,
   "store_id": 1,
   "segment": "fresh",
   "weekday": 3,
   "demand_t": 0.9263
  },
  {
   "scenario_id": 1,
   "store_id": 1,
   "segment": "fresh",
   "weekday": 4,
   "demand_t": 1.1116
  },
  {
   "scenario_id": 1,
   "store_id": 1,
   "segment": "fresh",
   "weekday": 5,
   "demand_t": 1.0653
  },
  {
   "scenario_id": 1,
   "store_id": 1,
   "segment": "frozen",
   "weekday": 0,
   "demand_t": 0.1756
  },
  {
   "scenario_id": 1,
   "store_id": 1,
   "segment": "frozen",
   "weekday": 1,
   "demand_t": 0.1658
  },
  {
   "scenario_id": 1,
   "store_id": 1,
   "segment": "frozen",
   "weekday": 2,
   "demand_t": 0.1756
  },
  {
   "scenario_id": 1,
   "store_id": 1,
   "segment": "frozen",
   "weekday": 3,
   "demand_t": 0.1951
  },
  {
   "scenario_id": 1,
   "store_id": 1,
   "segment": "frozen",
   "weekday": 4,
   "demand_t": 0.2341
  },
  {
   "scenario_id": 1,
   "store_id": 1,
   "segment": "frozen",
   "weekday": 5,
   "demand_t": 0.2244
  },
  {
   "scenario_id": 1,
   "store_id": 9,
   "segment": "dry",
   "weekday": 0,
   "demand_t": 0.2792
  },
  {
   "scenario_id": 1,
   "store_id": 9,
   "segment": "dry",
   "weekday": 1,
   "demand_t": 0.2637
  },
  {
   "scenario_id": 1,
   "store_id": 9,
   "segment": "dry",
   "weekday": 2,
   "demand_t": 0.2792
  },
  {
   "scenario_id": 1,
   "store_id": 9,
   "segment": "dry",
   "weekday": 3,
   "demand_t": 0.3103
  },
  {
   "scenario_id": 1,
   "store_id": 9,
   "segment": "dry",
   "weekday": 4,
   "demand_t": 0.3723
  },
  {
   "scenario_id": 1,
   "store_id": 9,
   "segment": "dry",
   "weekday": 5,
   "demand_t": 0.3568
  },
  {
   "scenario_id": 1,
   "store_id": 9,
   "segment": "fresh",
   "weekday": 0,
   "demand_t": 0.4387
  },
  {
   "scenario_id": 1,
   "store_id": 9,
   "segment": "fresh",
   "weekday": 1,
   "demand_t": 0.4143
  },
  {
   "scenario_id": 1,
   "store_id": 9,
   "segment": "fresh",
   "weekday": 2,
   "demand_t": 0.4387
  },
  {
   "scenario_id": 1,
   "store_id": 9,
   "segment": "fresh",
   "weekday": 3,
   "demand_t": 0.4874
  },
  {
   "scenario_id": 1,
   "store_id": 9,
   "segment": "fresh",
   "weekday": 4,
   "demand_t": 0.5849
  },
  {
   "scenario_id": 1,
   "store_id": 9,
   "segment": "fresh",
   "weekday": 5,
   "demand_t": 0.5605
  },
  {
   "scenario_id": 1,
   "store_id": 9,
   "segment": "frozen",
   "weekday": 0,
   "demand_t": 0.1316
  },
  {
   "scenario_id": 1,
   "store_id": 9,
   "segment": "frozen",
   "weekday": 1,
   "demand_t": 0.1243
  },
  {
   "scenario_id": 1,
   "store_id": 9,
   "segment": "frozen",
   "weekday": 2,
   "demand_t": 0.1316
  },
  {
   "scenario_id": 1,
   "store_id": 9,
   "segment": "frozen",
   "weekday": 3,
   "demand_t": 0.1462
  },
  {
   "scenario_id": 1,
   "store_id": 9,
   "segment": "frozen",
   "weekday": 4,
   "demand_t": 0.1755
  },
  {
   "scenario_id": 1,
   "store_id": 9,
   "segment": "frozen",
   "weekday": 5,
   "demand_t": 0.1682
  },
  {
   "scenario_id": 1,
   "store_id": 12,
   "segment": "dry",
   "weekday": 0,
   "demand_t": 1.0654
  },
  {
   "scenario_id": 1,
   "store_id": 12,
   "segment": "dry",
   "weekday": 1,
   "demand_t": 1.0062
  },
  {
   "scenario_id": 1,
   "store_id": 12,
   "segment": "dry",
   "weekday": 2,
   "demand_t": 1.0654
  },
  {
   "scenario_id": 1,
   "store_id": 12,
   "segment": "dry",
   "weekday": 3,
   "demand_t": 1.1838
  },
  {
   "scenario_id": 1,
   "store_id": 12,
   "segment": "dry",
   "weekday": 4,
   "demand_t": 1.4205
  },
  {
   "scenario_id": 1,
   "store_id": 12,
   "segment": "dry",
   "weekday": 5,
   "demand_t": 1.3613
  },
  {
   "scenario_id": 1,
   "store_id": 12,
   "segment": "fresh",
   "weekday": 0,
   "demand_t": 1.6459
  },
  {
   "scenario_id": 1,
   "store_id": 12,
   "segment": "fresh",
   "weekday": 1,
   "demand_t": 1.5544
  },
  {
   "scenario_id": 1,
   "store_id": 12,
   "segment": "fresh",
   "weekday": 2,
   "demand_t": 1.6459
  },
  {
   "scenario_id": 1,
   "store_id": 12,
   "segment": "fresh",
   "weekday": 3,
   "demand_t": 1.8288
  },
  {
   "scenario_id": 1,
   "store_id": 12,
   "segment": "fresh",
   "weekday": 4,
   "demand_t": 2.1945
  },
  {
   "scenario_id": 1,
   "store_id": 12,
   "segment": "fresh",
   "weekday": 5,
   "demand_t": 2.1031
  },
  {
   "scenario_id": 1,
   "store_id": 12,
   "segment": "frozen",
   "weekday": 0,
   "demand_t": 0.4366
  },
  {
   "scenario_id": 1,
   "store_id": 12,
   "segment": "frozen",
   "weekday": 1,
   "demand_t": 0.4123
  },
  {
   "scenario_id": 1,
   "store_id": 12,
   "segment": "frozen",
   "weekday": 2,
   "demand_t": 0.4366
  },
  {
   "scenario_id": 1,
   "store_id": 12,
   "segment": "frozen",
   "weekday": 3,
   "demand_t": 0.4851
  },
  {
   "scenario_id": 1,
   "store_id": 12,
   "segment": "frozen",
   "weekday": 4,
   "demand_t": 0.5821
  },
  {
   "scenario_id": 1,
   "store_id": 12,
   "segment": "frozen",
   "weekday": 5,
   "demand_t": 0.5579
  },
  {
   "scenario_id": 1,
   "store_id": 49,
   "segment": "dry",
   "weekday": 0,
   "demand_t": 0.7748
  },
  {
   "scenario_id": 1,
   "store_id": 49,
   "segment": "dry",
   "weekday": 1,
   "demand_t": 0.7318
  },
  {
   "scenario_id": 1,
   "store_id": 49,
   "segment": "dry",
   "weekday": 2,
   "demand_t": 0.7748
  },
  {
   "scenario_id": 1,
   "store_id": 49,
   "segment": "dry",
   "weekday": 3,
   "demand_t": 0.8609
  },
  {
   "scenario_id": 1,
   "store_id": 49,
   "segment": "dry",
   "weekday": 4,
   "demand_t": 1.0331
  },
  {
   "scenario_id": 1,
   "store_id": 49,
   "segment": "dry",
   "weekday": 5,
   "demand_t": 0.99
  },
  {
   "scenario_id": 1,
   "store_id": 49,
   "segment": "fresh",
   "weekday": 0,
   "demand_t": 1.1843
  },
  {
   "scenario_id": 1,
   "store_id": 49,
   "segment": "fresh",
   "weekday": 1,
   "demand_t": 1.1185
  },
  {
   "scenario_id": 1,
   "store_id": 49,
   "segment": "fresh",
   "weekday": 2,
   "demand_t": 1.1843
  },
  {
   "scenario_id": 1,
   "store_id": 49,
   "segment": "fresh",
   "weekday": 3,
   "demand_t": 1.3159
  },
  {
   "scenario_id": 1,
   "store_id": 49,
   "segment": "fresh",
   "weekday": 4,
   "demand_t": 1.5791
  },
  {
   "scenario_id": 1,
   "store_id": 49,
   "segment": "fresh",
   "weekday": 5,
   "demand_t": 1.5133
  },
  {
   "scenario_id": 1,
   "store_id": 49,
   "segment": "frozen",
   "weekday": 0,
   "demand_t": 0.3731
  },
  {
   "scenario_id": 1,
   "store_id": 49,
   "segment": "frozen",
   "weekday": 1,
   "demand_t": 0.3524
  },
  {
   "scenario_id": 1,
   "store_id": 49,
   "segment": "frozen",
   "weekday": 2,
   "demand_t": 0.3731
  },
  {
   "scenario_id": 1,
   "store_id": 49,
   "segment": "frozen",
   "weekday": 3,
   "demand_t": 0.4146
  },
  {
   "scenario_id": 1,
   "store_id": 49,
   "segment": "frozen",
   "weekday": 4,
   "demand_t": 0.4975
  },
  {
   "scenario_id": 1,
   "store_id": 49,
   "segment": "frozen",
   "weekday": 5,
   "demand_t": 0.4767
  },
  {
   "scenario_id": 1,
   "store_id": 77,
   "segment": "dry",
   "weekday": 0,
   "demand_t": 1.263
  },
  {
   "scenario_id": 1,
   "store_id": 77,
   "segment": "dry",
   "weekday": 1,
   "demand_t": 1.1928
  },
  {
   "scenario_id": 1,
   "store_id": 77,
   "segment": "dry",
   "weekday": 2,
   "demand_t": 1.263
  },
  {
   "scenario_id": 1,
   "store_id": 77,
   "segment": "dry",
   "weekday": 3,
   "demand_t": 1.4034
  },
  {
   "scenario_id": 1,
   "store_id": 77,
   "segment": "dry",
   "weekday": 4,
   "demand_t": 1.684
  },
  {
   "scenario_id": 1,
   "store_id": 77,
   "segment": "dry",
   "weekday": 5,
   "demand_t": 1.6139
  },
  {
   "scenario_id": 1,
   "store_id": 77,
   "segment": "fresh",
   "weekday": 0,
   "demand_t": 1.8431
  },
  {
   "scenario_id": 1,
   "store_id": 77,
   "segment": "fresh",
   "weekday": 1,
   "demand_t": 1.7407
  },
  {
   "scenario_id": 1,
   "store_id": 77,
   "segment": "fresh",
   "weekday": 2,
   "demand_t": 1.8431
  },
  {
   "scenario_id": 1,
   "store_id": 77,
   "segment": "fresh",
   "weekday": 3,
   "demand_t": 2.0479
  },